topic;words
0.0;network model algorithm control method data time problem optim perform propos system design power approach simul scheme function process comput detect channel analysi result estim applic present techniqu imag high
1.0;servic user data model learn network manag inform develop system agent research design softwar mobil game applic technolog social process resourc secur languag knowledg environ interact approach provid support cloud
2.0;imag graph method algorithm featur estim segment classif learn object problem propos detect recognit data point model color local edg cluster filter train function dataset nois sampl space label reconstruct
3.0;vote ein hypergraph werden wird mirna voter obfusc elect einer sich durch jam phish zusammenfassung sind rung kutta crowdsens auch jammer nicht dieser beitrag oder dass dies einem einen spinal
4.0;diabet handoff weld cathet dedupl wifi graphen harq seam retinopathi zigbe firewal ablat insulin toeplitz chat urllc comic vandermond resiz compand canal tridiagon subnet carv tele telecar epon runoff patient
5.0;subdivis rendezv persona keyfram xpath spray lightn dive camouflag hellman diffi imageclef fibrosi archimedean scatteromet dial sculptur weblog femtocel gist conjectur detour subcub nomad paint diver sich synerget breakdown unternehmen
